VPNCode;AGE;WORK;Gender_Männlich;Gender_Weiblich;Edu_Abitur_oder_Fachabitur;Edu_Bachelor;Edu_Master;AILiteracy[Use];AILiteracy[Kno];AILiteracy[Det];AILiteracy[Eth];PGAT;NGAT;CMV;NEO[E];NEO[A];NEO[C];NEO[N];NEO[O];JC1[IStR];JC1[HRJD];SE1;SDT1[AUT];SDT1[COM];PROD1;TASKDIF1;MANI1;JC2[IStR];JC2[HRJD];SE2;SDT2[AUT];SDT2[COM];PROD2;TASKDIF2;MANI2;total_time;syst_total_time;time_demogr;time_pers;time_task1;time_survey1;time_task2;time_survey2
AHO1006;26;40;1;0;0;1;0;4.666666667;4.666666667;4;3.5;4.333333333;2;4.666666667;3;4;3.75;1.75;3.4;2.4;2.25;100;2;2;2;2;Ich musste eine Kommunikationsstrategie erstellen um Nachhaltigkeit im Unternehmen einzuführen. Hierzu hatte ich wenige Informationen und keine Hilfsmittel.;2.8;5;20;3;5;5;5;Ich musste ein Konzept zum Thema digitale Transformation entwickeln und konnte dabei auch chatgpt als Hilfsmittel zugreifen.;18.9;8.209333333;2.806333333;0.800666667;0.156833333;2.161666667;0.0625;2.221333333
AWA2505;21;20;0;1;1;0;0;3.833333333;3.5;3;2.5;4;3;4;2.5;2.5;3.5;2.75;4;3.4;2;100;3;3;2;2;Ich musste einen einwöchige Kommunikationsstrategie für ein Vorstandstreffen eines Unternehmens erstellen um Nachhaligkeit als neuen Kernwert einzuführen. Mir standen keine Hilfsmittel zur Verfügung.;3.2;4.5;10;4;5;3;2;Ich musste einen eintägigen Veranstaltungsplan erstellen für Führungskräfte zum über die digitale Transformation zu diskutieren. Mir stand ChatGPT zur Verfügung.;40.63333333;40.6715;3.224333333;1.34;15.11283333;3.292;15.217;2.485333333
EZA0703;22;10;1;0;1;0;0;4.166666667;4.166666667;3.333333333;3;4.333333333;3;4.333333333;3.25;3;3.5;3;3.8;4.2;4.5;35;3;4;4;4;Ziel war es einen One-Pager für eine Veranstaltung zu erstellen. Es war wichtig, dass die Veranstaltung informativ, aber auch gesellig ist. Zielgruppe waren Führungskräfte. Hilfsmittel - AI-Chatbot;3.8;2;100;3;4;3;2;Ziel war es einen einwöchigen Workshop zum Thema Nachhaltigkeit als Kernwert zu erstellen. Dabei war es wichtig, die Veranstaltung informativ und interessant zu gestalten. Es standen keine Hilfsmittel zur Verfügung.;32.33333333;32.383;3.060333333;1.3105;11.24;3.083;11.16233333;2.526833333
AGU2207;23;40;1;0;0;1;0;4.166666667;3.5;3;2.5;5;3.333333333;4.666666667;3;2.75;3.25;3.75;4;3.6;3;50;2;5;3;3;Ich sollte in der Aufgabe eine Strategie ausarbeiten durch die Nachhaltigkeit als neuer Kernwert in das Unternehmen aufgenommen werden soll. Dafür sollte ich eine Woche mit Aufgaben und Impulsen gestallten die sicherstellt, dass alle relevanten Stakeholder eingeschlossen werden. Ich konnte zur Bearbeitung ChatGPT als KI nutzen, die mir eine erste Vorlage für die Woche gegeben hat in die ich reinarbeiten konnte.;3;2.25;100;2;2;3;3;Ich sollte einen Tag konzipieren bei dem Führungskräfte unserer Firma Impulse zur digitalen Transformation kriegen. Dafür habe ich den Ablauf des Tages konzipiert in dem durch verschiedene Workshops die Potenziale aufgezeigt werden sollte. KI hatte ich in dieser Aufgabe nicht als Unterstützung.;43.85;43.90966667;2.6275;1.146833333;22.23016667;3.959666667;0.0835;13.862
NPR1810;22;10;0;1;0;1;0;3.5;3.833333333;3.333333333;2;3;3.333333333;1.666666667;3.25;3.75;4;2.75;4;2.8;3;75;4;4;3;3;In der vorangegangenen Aufgabe musste ich einen Kommunikationsplan (für die kommende Wovche) erstellen, welcher eine von mir vorgeschlagene Strategie zur fördern von Nachhaltigkeit im Unternehmen und gegenüber der Unternehmensumwelt, namentlich durch geeignete Strategiemassnahmen, kommunizieren soll. Als Hilfsmittel stand mir die Chatfuntion von ChatGPT zur Verfügung, diese habe ich einmal zur ersten Ideenorientierung benutzt, und mich miti 3 Ideen auf sie berufen.;3.6;1.5;100;4;4;4;4;In der vorigen Aufgabe sollte ein Tagesprogramm für ein Workshop-ähnliches Format zur Weiterbildung von Führungskräften in Bezug auf digitale Transformation entwickelt werden. Bis auf die 3 beispielhaften Leitfragen in der Angabe standen keine Hilfsmittel zur Verfügung.;42.75;42.79316667;3.0905;1.1985;19.8285;4.353;11.81983333;2.502833333
RBO0106;18;50;0;1;1;0;0;3.666666667;3.833333333;4.333333333;3.5;2.666666667;3.333333333;4;2.75;3.5;3.75;2.5;4;2.4;5;5;3;4;4;4;Ich musste fur meinen chef ein ein-woches lang kommunikationsplan machen. Chat Gpt hat mir geholfen um es zu machen. Es war schnell und ich musste nicht viel daruber denken.;4.2;2.25;100;3;4;3;3;Ich hatte keine hilfsmittel. Ich mustte die aufgabe alleine lossen was langsamer war. Ohne hilfsmittel und nicht viele kentnisse uber das thema war es schwierig.;38.53333333;38.56466667;5.9635;2.541166667;10.40033333;4.934333333;10.90116667;3.824166667
DPR0408;33;30;0;1;0;0;1;2.666666667;3.333333333;3.666666667;3.5;3.333333333;2.333333333;3.333333333;3.5;3;3.5;2.5;3.8;3.8;5;90;4;4;3;4;Ich musste in kurzer Zeit für eine vorgesetzte Person einen Veranstaltungsentwurf bereitstellen und hatte Chat GPT als Unterstützung. Die Veranstaltung sollte für Führungskräfte sein und das Thema der digitalen Transformation behandeln.;3;1.75;80;2;3;4;2;Ich musste für ein Unternehmen eine Kommunikationsstrategie für die Nachhaltigkeit entwickeln. Es standen mir Leitfragen, aber keine weiteren Hilfsmittel zur Verfügung.;32.91666667;32.97916667;2.219833333;1.313666667;11.03083333;3.081666667;0.129666667;15.2035
EDE0211;47;60;1;0;0;0;1;5;3.666666667;4.333333333;4;5;3;3.666666667;3.25;3.5;3.75;3.5;4.2;4.4;4.5;40;5;4;4;3;Ich musste in einem One-Pager ein Nachhaltigkeitskonzept in wenigen Minuten erstellen. Dabei durfte ich die GPT als Unterstützung benutzen.;2.6;3.25;100;5;4;4;2;Ich musste in einem One-Pager ein kleines Event-Konzept zur digitalen Transformation für Führungskräfte erstellen. Dabei durfte ich keine Hilfsmittel verwenden bzw. habe absolut keine benützt. Dies unter Zeitdruck.;48.45;48.48983333;3.5365;1.592666667;38.046;2.550333333;0.049333333;2.715
OBA0612;28;70;0;1;0;0;1;5;4.5;3.333333333;4;4.666666667;3.333333333;4.333333333;4;4;4.25;4;4.4;4.25;4;100;5;3;4;3;Ich sollte ein eintägige Veranstaltung für Vorstände planen die über Digitalisierung informiert werden sollten. Dabei hatte ich keine Hilfsmittel zur Verfügung;3.6;4;40;2;4;4;3;Ich musste ein einwöchiges Seminar für Vorstände entwickeln um das Thema Nachhaltigkeit zu erarbeiten und sie zu animieren es in ihren unternehmen mehr umzusetzen. Ich hatte Chat GPT als Hilfsmittel.;31.65;31.70766667;2.022666667;0.846833333;12.37983333;2.555166667;11.80366667;2.0995
LCH0603;19;10;1;0;1;0;0;3.833333333;3.833333333;3.333333333;2.5;3.666666667;3;5;3;3.75;3.75;2.25;4;3;1;100;4;5;5;4;Keine Hilfsmittel, ich musste einen Plan für eine eintägige Veranstaltung für Führungspositionen zum Thema digitale Transformation erstellen.;2;4.5;10;2;5;1;4;ChatGPT, ich musste eine einwöchige Kommunikationsstrategie für die Wichtigkeit des Themas 'Nachhaltigkeit' erstellen.;28.23333333;28.31283333;3.438166667;1.399;13.3075;2.897833333;0.059833333;7.2105
IST0303;23;20;1;0;0;0;1;5;4.166666667;4;2.5;5;3.333333333;4;3;3;3.75;3;4.4;3;4;100;3;5;3;5;Ich musste mir ein Event für Vorstandsmitglieder überlegen, damit diese mehr über das Thema KI lernen. Es standen mir keine Hilfsmittel zu verfügung;2.6;4.75;20;2;4;4;4;Ich musste eine Kommunikationswoche für ein Unternehmen überlegen um über das Thema Nachhaltigkeit in dem unternehmen zu sprechen und die UnternemensZiele darzustellen. Ich hatte ChatGPt als unterstützung.;28.66666667;28.71733333;2.215;1.060833333;8.564;2.3235;0.085;14.469
EBO1608;30;60;1;0;0;1;0;4.333333333;4.166666667;3;3.5;3.333333333;3;3.666666667;3.5;3.75;3.75;3.5;4.2;2.6;4.25;20;3;4;4;4;Ich musste ein eintägiges Vorstandsmeeting zum Thema Digitale Transformation für meinen Vorgesetzten vorbereiten. Als Hilfsmittel stand mir ChatGPT zur Verfügung.;4.2;1.75;100;4;4;5;3;Ich musste eine einwöchige Kommunikationsstrategie für mein Unternehmen entwickeln um Nachhaltigkeit als Kernwert zu etablieren. Mir standen keine Hilfsmittel zur Verfügung.;26.83333333;26.86266667;2.384166667;1.3555;7.7295;2.800166667;0.091;12.50233333
EUN2402;26;25;1;0;0;1;0;4.5;4;4;2.5;4.333333333;2.333333333;3;3.5;3.25;3.5;4;2.8;3.8;4.75;70;4;4;5;4;Ich musste einen One Pager erstellen. Dieser sollte das Konzept aufzeigen für einen eintägigen Workshop mit Führungskräften um dabei digitale Transformation mit generative KI kennenzulernen. Zur Erfüllung der Aufgabe stand mir eine generative KI zur Seite plus eine Beschreibung wie man generative KI am besten nutzen kann;3.2;4.75;70;3;4;4;4;Es sollte erneut ein One-Pager für den Vorstand erstellt werden. Diesmal sollte eine einwöchige Kommunikationsstrategie vorgestellt werden welche Nachhaltigkeit als Kernwert vom Unternehmen vorstellt. Hierfür stand mir eine generative KI zur Verfügung;33.51666667;33.56733333;2.4435;0.8575;14.55366667;2.781833333;10.68983333;2.241
ABE0509;24;70;1;0;0;0;1;4.833333333;4;4;3.5;5;2.333333333;4;3.25;3;4;2.25;3.6;3.8;4.75;5;3;3;4;4;Die Aufgabe war es einen One Pager für ein eintägiges Event für Vorstandsmitglieder zu entwerfen. Das Thema des Events sollte die digitale Transformation sein. Hierfür gab es noch weitere Einschränkungen, e.g., das Event sollte informativ und unterhaltsam sein. Hierfür durfte mal ChatGPT verwenden.;3.6;2;95;3;4;4;4;Die Aufgabe war es ohne Hilfsmittel eine einwöchige Kommunikationsstrategie zu entwerfen, die Nachhaltigkeit als Kernwert der Unternehmensstrategie vorstellt.;37.06666667;37.126;3.222333333;1.587333333;17.34066667;3.2125;9.165833333;2.597333333
SME3112;22;80;0;1;1;0;0;3.166666667;3;4.333333333;3.5;1.666666667;3;5;3.25;3;3.75;2;3.4;3;2.5;50;2;2;2;2;in der Aufgbe, musste wir ein Kommuniktionstrategie von nachhaltigkeit als Kertwert. Fur diese Aufgabe zu machen ich habe zum 4 fragen antworten, zum beispiel welche ist das Publikum und welche ist die beste Strtegie.;4.6;4;90;3;4;4;2;in diese Aufgabe ich habe mit der Hilfe von Chatgpt eine Plan gemacht  für neue Technologie zu verstehen und wie knn wir eine Akton Plan machen;40.46666667;40.50083333;6.0375;2.774;9.804333333;5.5375;11.53866667;4.808833333
OLI1612;24;40;1;0;0;1;0;4;4.666666667;3.666666667;3;3.666666667;3.333333333;5;3;2.75;3.5;2.25;4;4.2;3.25;90;4;4;4;2;Ich habe in der vorherigen Aufgabe eine Kommunikationsstrategie erstellt zum Thema Nachhaltigkeit. Ich habe dafür keine Hilfsmittel benutzt.;3.4;4;40;3;4;3;3;"Ziel der Aufgabe war das Organisieren einer Veranstaltung, in der Führungskräfte über das Thema ""Einfluss der KI auf Geschäftsmodelle"" informiert werden sollten und ihnen die Möglichkeit gegegeben werden sollte, darüber zu diskutieren. Ich habe als Hilfsmittel ChatGPT genutzt.";43.43333333;43.495;3.459166667;1.7075;17.29133333;3.1645;0.696;17.1765
NBA1601;23;60;1;0;0;1;0;4.333333333;3.333333333;3.333333333;3.5;4;3;4.666666667;3;3.5;4;2.25;3.4;3.8;2.5;90;4;3;4;2;Ich musste eine Kommunikationsstrategie entwickeln für eine Woche. Wichtig war, die Adressaten (Mitarbeiter, Stakeholder etc.) gut einzuholen in dieser Mail, die ich geschrieben habe.;2.6;3.75;10;3;3;2;2;Ich musste für ein Unternehmen eine Art Workshop vorbereiten. Das Thema um was es ging war digitale Transformation im Unternehmen;57.18333333;57.21616667;9.6345;2.003333333;23.74466667;3.730166667;15.33466667;2.768833333
